{
  "$defs": {
    "entry": {
      "additionalProperties": false,
      "properties": {
        "assistant_contestant_allowed": {
          "const": false
        },
        "canon_write_allowed": {
          "const": false
        },
        "direct_tos_write_allowed": {
          "const": false
        },
        "forbidden_effects": {
          "items": {
            "minLength": 1,
            "type": "string"
          },
          "minItems": 1,
          "type": "array"
        },
        "live_protocol": {
          "const": false
        },
        "package_id": {
          "minLength": 1,
          "type": "string"
        },
        "purpose": {
          "minLength": 1,
          "type": "string"
        },
        "required_evidence": {
          "items": {
            "minLength": 1,
            "type": "string"
          },
          "minItems": 1,
          "type": "array"
        },
        "requires_review": {
          "const": true
        },
        "review_status": {
          "const": "candidate_only"
        },
        "runtime_effect": {
          "enum": [
            "none",
            "candidate_only",
            "local_dry_run_candidate_only",
            "local_rehearsal_candidate_only"
          ]
        },
        "tos_canonization_allowed": {
          "const": false
        },
        "stage": {
          "const": "XVIII"
        },
        "stage_name": {
          "const": "Sophian Threshold"
        }
      },
      "required": [
        "assistant_contestant_allowed",
        "canon_write_allowed",
        "direct_tos_write_allowed",
        "forbidden_effects",
        "live_protocol",
        "package_id",
        "purpose",
        "required_evidence",
        "requires_review",
        "review_status",
        "runtime_effect",
        "tos_canonization_allowed",
        "stage",
        "stage_name"
      ],
      "title": "agon-sophian-memo-evidence.schema.json item contract",
      "type": "object"
    }
  },
  "$schema": "https://json-schema.org/draft/2020-12/schema",
  "additionalProperties": false,
  "properties": {
    "count": {
      "const": 6
    },
    "digest": {
      "pattern": "^[0-9a-f]{64}$",
      "type": "string"
    },
    "registry_id": {
      "const": "agon.sophian_memo_evidence.registry.v1"
    },
    "runtime_posture": {
      "const": "candidate_only"
    },
    "sophian_memo_evidence_packages": {
      "items": {
        "$ref": "#/$defs/entry"
      },
      "maxItems": 6,
      "minItems": 6,
      "type": "array"
    },
    "stage": {
      "const": "XVIII"
    },
    "stage_name": {
      "const": "Sophian Threshold"
    }
  },
  "required": [
    "registry_id",
    "stage",
    "stage_name",
    "runtime_posture",
    "count",
    "sophian_memo_evidence_packages",
    "digest"
  ],
  "title": "agon.sophian_memo_evidence.registry.v1 generated registry contract",
  "type": "object"
}
