{
  "count": 6,
  "digest": "24bd9cf9730b750a95d8eb077ca92884fa377c08e7d096e347bd7a5cd5062089",
  "registry_id": "agon.sophian_memo_evidence.registry.v1",
  "runtime_posture": "candidate_only",
  "sophian_memo_evidence_packages": [
    {
      "assistant_contestant_allowed": false,
      "canon_write_allowed": false,
      "direct_tos_write_allowed": false,
      "forbidden_effects": [
        "live_verdict_authority",
        "durable_scar_write",
        "retention_execution",
        "rank_mutation",
        "trust_mutation",
        "tree_of_sophia_canon_write",
        "direct_tos_write",
        "automatic_canonization",
        "kag_as_canon",
        "hidden_scheduler_action",
        "assistant_contestant_drift",
        "auto_doctrine_rewrite",
        "center_takeover_of_owner_truth",
        "eval_memo_stats_sovereignty",
        "stats_as_canon_authority",
        "eval_as_canon_authority",
        "memo_as_canon_authority",
        "sdk_hidden_write"
      ],
      "live_protocol": false,
      "package_id": "agon.memo.sophian.threshold_evidence_package",
      "purpose": "Assemble memory evidence for ToS threshold review.",
      "required_evidence": [
        "scar_delta_lineage",
        "retention_evidence",
        "campaign_chronicle"
      ],
      "requires_review": true,
      "review_status": "candidate_only",
      "runtime_effect": "candidate_only",
      "tos_canonization_allowed": false,
      "stage": "XVIII",
      "stage_name": "Sophian Threshold"
    },
    {
      "assistant_contestant_allowed": false,
      "canon_write_allowed": false,
      "direct_tos_write_allowed": false,
      "forbidden_effects": [
        "live_verdict_authority",
        "durable_scar_write",
        "retention_execution",
        "rank_mutation",
        "trust_mutation",
        "tree_of_sophia_canon_write",
        "direct_tos_write",
        "automatic_canonization",
        "kag_as_canon",
        "hidden_scheduler_action",
        "assistant_contestant_drift",
        "auto_doctrine_rewrite",
        "center_takeover_of_owner_truth",
        "eval_memo_stats_sovereignty",
        "stats_as_canon_authority",
        "eval_as_canon_authority",
        "memo_as_canon_authority",
        "sdk_hidden_write"
      ],
      "live_protocol": false,
      "package_id": "agon.memo.sophian.long_retention_package",
      "purpose": "Bundle long-window retention records for threshold review.",
      "required_evidence": [
        "retention_result_candidates",
        "repeat_failure_absence_or_record"
      ],
      "requires_review": true,
      "review_status": "candidate_only",
      "runtime_effect": "candidate_only",
      "tos_canonization_allowed": false,
      "stage": "XVIII",
      "stage_name": "Sophian Threshold"
    },
    {
      "assistant_contestant_allowed": false,
      "canon_write_allowed": false,
      "direct_tos_write_allowed": false,
      "forbidden_effects": [
        "live_verdict_authority",
        "durable_scar_write",
        "retention_execution",
        "rank_mutation",
        "trust_mutation",
        "tree_of_sophia_canon_write",
        "direct_tos_write",
        "automatic_canonization",
        "kag_as_canon",
        "hidden_scheduler_action",
        "assistant_contestant_drift",
        "auto_doctrine_rewrite",
        "center_takeover_of_owner_truth",
        "eval_memo_stats_sovereignty",
        "stats_as_canon_authority",
        "eval_as_canon_authority",
        "memo_as_canon_authority",
        "sdk_hidden_write"
      ],
      "live_protocol": false,
      "package_id": "agon.memo.sophian.lineage_memory_packet",
      "purpose": "Bundle school/lineage/campaign memory as threshold evidence.",
      "required_evidence": [
        "lineage_record_candidate",
        "campaign_chronicle_candidate"
      ],
      "requires_review": true,
      "review_status": "candidate_only",
      "runtime_effect": "candidate_only",
      "tos_canonization_allowed": false,
      "stage": "XVIII",
      "stage_name": "Sophian Threshold"
    },
    {
      "assistant_contestant_allowed": false,
      "canon_write_allowed": false,
      "direct_tos_write_allowed": false,
      "forbidden_effects": [
        "live_verdict_authority",
        "durable_scar_write",
        "retention_execution",
        "rank_mutation",
        "trust_mutation",
        "tree_of_sophia_canon_write",
        "direct_tos_write",
        "automatic_canonization",
        "kag_as_canon",
        "hidden_scheduler_action",
        "assistant_contestant_drift",
        "auto_doctrine_rewrite",
        "center_takeover_of_owner_truth",
        "eval_memo_stats_sovereignty",
        "stats_as_canon_authority",
        "eval_as_canon_authority",
        "memo_as_canon_authority",
        "sdk_hidden_write"
      ],
      "live_protocol": false,
      "package_id": "agon.memo.sophian.branch_survival_memory_packet",
      "purpose": "Bundle bifurcation and branch survival history.",
      "required_evidence": [
        "branch_survival_candidate",
        "battle_record_bundle"
      ],
      "requires_review": true,
      "review_status": "candidate_only",
      "runtime_effect": "candidate_only",
      "tos_canonization_allowed": false,
      "stage": "XVIII",
      "stage_name": "Sophian Threshold"
    },
    {
      "assistant_contestant_allowed": false,
      "canon_write_allowed": false,
      "direct_tos_write_allowed": false,
      "forbidden_effects": [
        "live_verdict_authority",
        "durable_scar_write",
        "retention_execution",
        "rank_mutation",
        "trust_mutation",
        "tree_of_sophia_canon_write",
        "direct_tos_write",
        "automatic_canonization",
        "kag_as_canon",
        "hidden_scheduler_action",
        "assistant_contestant_drift",
        "auto_doctrine_rewrite",
        "center_takeover_of_owner_truth",
        "eval_memo_stats_sovereignty",
        "stats_as_canon_authority",
        "eval_as_canon_authority",
        "memo_as_canon_authority",
        "sdk_hidden_write"
      ],
      "live_protocol": false,
      "package_id": "agon.memo.sophian.rejection_return_memory_packet",
      "purpose": "Record ToS rejection/defer/return outcomes as memory candidates.",
      "required_evidence": [
        "tos_notice_candidate",
        "return_route"
      ],
      "requires_review": true,
      "review_status": "candidate_only",
      "runtime_effect": "candidate_only",
      "tos_canonization_allowed": false,
      "stage": "XVIII",
      "stage_name": "Sophian Threshold"
    },
    {
      "assistant_contestant_allowed": false,
      "canon_write_allowed": false,
      "direct_tos_write_allowed": false,
      "forbidden_effects": [
        "live_verdict_authority",
        "durable_scar_write",
        "retention_execution",
        "rank_mutation",
        "trust_mutation",
        "tree_of_sophia_canon_write",
        "direct_tos_write",
        "automatic_canonization",
        "kag_as_canon",
        "hidden_scheduler_action",
        "assistant_contestant_drift",
        "auto_doctrine_rewrite",
        "center_takeover_of_owner_truth",
        "eval_memo_stats_sovereignty",
        "stats_as_canon_authority",
        "eval_as_canon_authority",
        "memo_as_canon_authority",
        "sdk_hidden_write"
      ],
      "live_protocol": false,
      "package_id": "agon.memo.sophian.boundary_breach_package",
      "purpose": "Capture any direct-canonization attempt for quarantine review.",
      "required_evidence": [
        "breach_signal",
        "source_boundary_check"
      ],
      "requires_review": true,
      "review_status": "candidate_only",
      "runtime_effect": "candidate_only",
      "tos_canonization_allowed": false,
      "stage": "XVIII",
      "stage_name": "Sophian Threshold"
    }
  ],
  "stage": "XVIII",
  "stage_name": "Sophian Threshold"
}
